<?xml version="1.0" encoding="UTF-8"?>
<xs:schema xmlns:xs="http://www.w3.org/2001/XMLSchema">
    <xs:element name="users">
        <xs:complexType>
            <xs:sequence>
                <xs:element name="user" minOccurs="0" maxOccurs="unbounded">
                    <xs:complexType>
                        <xs:sequence>
                            <xs:element name="user_id" type="id"></xs:element>
                            <xs:element name="username" type="xs:string"></xs:element>
                            <xs:element name="password" type="xs:string"></xs:element>
                            <xs:element name="notes" type="xs:string"></xs:element>
                        </xs:sequence>
                        <xs:attribute name="user_type" type="usertype" use="required"></xs:attribute>
                    </xs:complexType>
                </xs:element>
            </xs:sequence>
        </xs:complexType>
    </xs:element>
    <xs:simpleType name="usertype">
        <xs:restriction base="xs:string">
            <xs:enumeration value="admin" />
            <xs:enumeration value="client" />
            <xs:enumeration value="support" />
        </xs:restriction>
    </xs:simpleType>
    <xs:simpleType name="id">
        <xs:restriction base="xs:integer">
            <xs:minInclusive value="1" />
        </xs:restriction>
    </xs:simpleType>
</xs:schema>